{
  "schema_version": 1,
  "schema_id": "cargo-allow.source-candidate-smoke-receipt.v1",
  "tool": "cargo-allow",
  "result": "Passed",
  "claim_boundary": [
    "installed_binary_first_hour_journey",
    "refresh_diff_and_prune_lifecycle",
    "temporary_consumer_repository",
    "source_candidate_not_published_registry",
    "post_install_source_hidden_ordinary_scan",
    "ordinary_scan_does_not_require_network",
    "policy_rollback_after_prune",
    "packaged_asset_omit_rebuild",
    "optional_profile_without_assets_not_proven"
  ],
  "candidate": {
    "workspace_version": "0.1.10",
    "git_head": "0000000000000000000000000000000000000000",
    "package_set_provenance": "workspace_path_install_after_optional_package_gate",
    "install_method": "cargo_install_path"
  },
  "environment": {
    "os": "linux",
    "arch": "x86_64",
    "rustc_version": null,
    "cargo_version": null,
    "network_posture": "not_required_for_core_journey"
  },
  "installed_binary": {
    "binary_sha256": "9a2b7ce54e17aaba0e2ee0a504f44b2d7321c15ad844b214c0a75ac7b88c5fbb",
    "version_output": "cargo-allow 0.1.10",
    "path_redacted": true
  },
  "journey": {
    "fixture_generation": "first_hour_brownfield_v1",
    "steps_expected": [
      "version",
      "doctor_no_policy",
      "audit_with_finding",
      "bootstrap_propose_write",
      "check_no_new_pass",
      "list_explain_worklist",
      "refresh_location_drift_preview_write",
      "diff_against_exact_base",
      "prune_stale_preview_write",
      "final_check_no_new",
      "policy_rollback_after_prune",
      "second_finding_why_plan_add",
      "targeted_recheck_after_add",
      "list_wide_projection",
      "clean_repo_init_audit_check"
    ],
    "steps_executed": [
      {
        "id": "version",
        "exit_code": 0,
        "artifact_schema_id": null
      },
      {
        "id": "doctor_no_policy",
        "exit_code": 0,
        "artifact_schema_id": "cargo-allow.doctor.v1"
      },
      {
        "id": "audit_with_finding",
        "exit_code": 0,
        "artifact_schema_id": "cargo-allow.report.v1"
      },
      {
        "id": "bootstrap_propose_write",
        "exit_code": 0,
        "artifact_schema_id": null
      },
      {
        "id": "check_no_new_pass",
        "exit_code": 0,
        "artifact_schema_id": "cargo-allow.report.v1"
      },
      {
        "id": "list_explain_worklist",
        "exit_code": 0,
        "artifact_schema_id": "cargo-allow.list.v1"
      },
      {
        "id": "refresh_location_drift_preview_write",
        "exit_code": 0,
        "artifact_schema_id": "cargo-allow.refresh.v1"
      },
      {
        "id": "diff_against_exact_base",
        "exit_code": 0,
        "artifact_schema_id": "cargo-allow.report.v1"
      },
      {
        "id": "prune_stale_preview_write",
        "exit_code": 0,
        "artifact_schema_id": "cargo-allow.prune.v1"
      },
      {
        "id": "final_check_no_new",
        "exit_code": 0,
        "artifact_schema_id": "cargo-allow.report.v1"
      },
      {
        "id": "policy_rollback_after_prune",
        "exit_code": 0,
        "artifact_schema_id": "cargo-allow.list.v1"
      },
      {
        "id": "second_finding_why_plan_add",
        "exit_code": 0,
        "artifact_schema_id": "cargo-allow.add.v1"
      },
      {
        "id": "targeted_recheck_after_add",
        "exit_code": 0,
        "artifact_schema_id": "cargo-allow.report.v1"
      },
      {
        "id": "list_wide_projection",
        "exit_code": 0,
        "artifact_schema_id": "cargo-allow.list.v1"
      },
      {
        "id": "clean_repo_init_audit_check",
        "exit_code": 0,
        "artifact_schema_id": "cargo-allow.report.v1"
      }
    ]
  },
  "negative_controls": [
    {
      "id": "omitted_journey_step_cannot_claim_passed",
      "result_class": "OmittedStep",
      "passed": true,
      "detail": "Passed receipt missing a steps_expected id is classified OmittedStep"
    },
    {
      "id": "prune_preview_apply_subject_agree",
      "result_class": "PreviewApplyDisagree",
      "passed": true,
      "detail": "forged prune write subject mismatch is classified PreviewApplyDisagree"
    },
    {
      "id": "refresh_preview_apply_subject_agree",
      "result_class": "PreviewApplyDisagree",
      "passed": true,
      "detail": "forged refresh write subject mismatch is classified PreviewApplyDisagree"
    },
    {
      "id": "malformed_smoke_receipt_cannot_claim_passed",
      "result_class": "MalformedArtifact",
      "passed": true,
      "detail": "Passed receipt with wrong schema_id is classified MalformedArtifact"
    },
    {
      "id": "post_install_source_hidden_ordinary_scan",
      "result_class": "CheckoutIsolated",
      "passed": true,
      "detail": "check --mode no-new after hiding crates/cargo-allow/src and docs/templates must still pass (CheckoutIsolated)"
    },
    {
      "id": "missing_asset_not_satisfied_by_source_checkout",
      "result_class": "MissingAsset",
      "passed": true,
      "detail": "package-rebuild omit of required README.md still present under source checkout is classified MissingAsset"
    },
    {
      "id": "wrong_installed_binary_version",
      "result_class": "StaleCandidate",
      "passed": true,
      "detail": "forged version_output mismatch vs workspace version is classified StaleCandidate"
    },
    {
      "id": "ordinary_scan_does_not_require_network",
      "result_class": "NetworkIsolated",
      "passed": true,
      "detail": "check --mode no-new under CARGO_NET_OFFLINE and bogus HTTP(S)_PROXY must still pass (NetworkIsolated)"
    },
    {
      "id": "unexpected_network_requirement_during_ordinary_scan",
      "result_class": "NetworkRequired",
      "passed": true,
      "detail": "ordinary scan success while network_was_required is classified NetworkRequired"
    },
    {
      "id": "failed_policy_rollback_after_prune",
      "result_class": "RecoveryFailed",
      "passed": true,
      "detail": "empty policy after pretended restore leaves prune allow absent (RecoveryFailed)"
    },
    {
      "id": "optional_profile_without_packaged_assets",
      "result_class": "NotProven",
      "passed": true,
      "detail": "selected optional profile codex-pack without packaged assets is classified NotProven"
    }
  ],
  "limitations": [
    "package_set_not_consumed_from_isolated_registry",
    "source_checkout_not_denied_during_install",
    "published_registry_install_not_executed",
    "linux_hosted_claim_only"
  ]
}
